FI_CODE,FI_BRANCH,FI_NAME_THAI,FI_NAME_ENG,OPEN_DATE
942,1137,สาขาหน้าค่ายสฤษดิ์,NA KHAI SARIT  BANTHAT,25590401
942,1138,สาขากกไม้แดง,KOK MAI DAENG BANTHAT,25590401
942,1139,สาขาระนอง,RANONG BANTHAT,25590401
942,1140,สาขาทุ่งใหญ่,THUNG YAI BANTHAT,25590401
942,1141,สาขาสามแยกพลับพลาชัย,SAMYAEK PHLAPPHLA CHAI BANTHAT,25590401
942,1142,สาขาสี่แยกดอนคลัง,SEEYAK DON KHLONG BANTHAT,25590401
942,1143,สาขาหนองกราด,NONG KRAT BANTHAT,25590401
942,1144,สาขาถนนราชดำเนิน (กำแพงเพชร),THANON RATCHADAMNOEN (KAMPHAENG PHET) BANTHAT,25590401
942,1145,สาขาโนนเจริญ,NON CHAROEN BANTHAT,25590401
942,1146,สาขาดอนแขวน,DON KWAEN  BANTHAT,25590401
942,1147,สาขาท่ามะนาว,THA MANAO BANTHAT,25590401
942,1148,สาขาซับน้อย,SAP NOI BANTHAT,25590401
942,1149,สาขาห้วยขุนราม,HUAI KHUN RAM BANTHAT,25590401
942,1150,สาขาแยกปงยางคก,YAEK PONG YANG KHOK  BANTHAT,25590401
942,1151,สาขาสี่แยกแวงโพนทอง,SEEYAKWAENG PHON THONG BANTHAT,25590401
942,1152,สาขาสี่แยกโค้งประปา,SEEYAK KOHNG PLUMBER,25590401
942,1153,สาขาวังหลุม,WANG LUM  BRANCH,25590501
942,1154,สาขาหมู่บ้านรักไทย,MOOBAN  LOVE  THAILAND  BRANCH,25590501
942,1155,สาขายางสีสุราช,YANG SISURAT  BRANCH,25590501
942,1156,สาขาไทรน้อย,SAI NOI  BRANCH,25590501
942,1157,สาขาน้ำยืน,NAM YUEN  BRANCH,25590501
942,1158,สาขาหนองสูง,NONG SUNG  BRANCH,25590501
942,1159,สาขาเมยวดี,MOEI WADI  BRANCH,25590501
942,1160,สาขาเลิงนกทา,LOENG NOK THA  BRANCH,25590501
942,1161,สาขาคำเขื่อนแก้ว,KHAM KHUEAN KAEO  BRANCH,25590501
942,1162,สาขาตราด,TRAT  BRANCH,25590501
942,1163,สาขาถนนพหลโยธิน 62,THANON PHAHOLYOTHIN 62  BRANCH,25590501
942,1164,สาขากระสัง,KRASANG  BRANCH,25590501
942,1165,สาขาสามแยก ธกส. มุกดาหาร,SAMYEK BAAC. MUKDAHAN  BRANCH,25590501
942,1166,สาขาดงหลวง,DONG LUANG  BRANCH,25590501
942,1167,สาขาดงมะไฟ,DONG MAFAI  BRANCH,25590501
942,1168,สาขาบ้านเส้ง,BAN SENG  BRANCH,25590501
942,1169,สาขาบ้านตลิ่งชั่น,BAN TALING CHAN  BRANCH,25590501
942,1170,สาขาชุมพวง,CHUM PHUANG  BRANCH,25590501
942,1171,สาขาหนองหงส์,NONG HONG  BRANCH,25590501
942,1172,สาขาลำทะเมนชัย,LAM THAMENCHAI  BRANCH,25590501
942,1173,สาขาหนองปรือ (บางละมุง),NONG PRUE (BANG LAMUNG)  BRANCH,25590501
942,1174,สาขาเสิงสาง,SOENG SANG  BRANCH,25590501
942,1175,สาขาโคกหลวงพ่อ,KHOK LUANG PHO  BRANCH,25590501
942,1176,สาขาราชภัฎกำแพงเพชร,RADPAT KAMPHAENG PHET  BRANCH,25590501
942,1177,สาขาโขดหิน-เขาไผ่,WAT KHOT HIN - KAO PAI  BRANCH,25590501
942,1178,สาขาสหฟาร์มกันจุ,SAHAFARMS KAN CHU  BRANCH,25590501
942,1179,สาขาถนนอรุณประเสริฐ อจ.,TANON ANUNPRASERT AMNAT CHAROEN  BRANCH,25590501
942,1180,สาขาท่าข้าม (เพชรบูรณ์),TAKAM (PHETCHABUN)  BRANCH,25590501
942,1181,สาขาตลิ่งชัน,TALING CHAN  BRANCH,25590501
942,1182,สาขาร่องแซง,RONG SANG  BRANCH,25590501
942,1183,สาขาถนนนวมินทร์,TANON NAWAMIN  BRANCH,25590501
942,1184,สาขาถนนวัดคู้บอน,TANON WAT KHU BON  BRANCH,25590501
942,1185,สาขาบางน้ำเปรี้ยว,BANG NAM PRIAO  BRANCH,25590501
942,1186,สาขาแม่สรวย,MAE SUAI  BRANCH,25590501
942,1187,สาขาเชิงทะเล,CHOENG THALE  BRANCH,25590501
942,1188,สาขาสี่แยกท่าเรือ ภูเก็ต,SEE YAEK PORT PHUKET  BRANCH,25590501
942,1189,สาขาตลาดทวีสมาน,TA LAT THAWI SAMAN   BRANCH,25590501
942,1190,สาขาดอนโม่,DON MO    BRANCH,25590501
942,1191,สาขาเกาะจันทร์,KO CHAN   BRANCH,25590501
942,1192,ถ.เชียงใหม่ – สันกำแพง,Tanon Chiang mai - Sankampang,25590501
942,1193,สาขาถนนแสนสุข,TANON SAEN SUK   BRANCH,25590501
942,1194,สาขาหัวอิฐ,HUA IT   BRANCH,25590501
942,1195,สาขาถนนเทพารักษ์สมุทรปราการ,THANON THEPHARAK SAMUT PRAKAN   BRANCH,25590501
942,1196,สาขาตลาดด่านสำโรง,TA LAT DANSAMRONG    BRANCH,25590501
942,1197,สาขาจังหาร,CHANGHAN   BRANCH,25590501
942,1198,สาขาปากห้วยวังนอง,PAK HUAI WANG NONG  BRANCH,25590601
942,1199,สาขาปทุมราชวงศา,PATHUM RATCHAWONGSA  BRANCH,25590601
942,1200,สาขาโนนทัน,NON THAN  BRANCH,25590601
942,1201,สาขาสี่แยกพ่อขุน,SEEYAK PORKUN  BRANCH,25590601
942,1202,สาขาถนนพระราม 2 ซ.62,THANON RAMA 2  SOI 62  BRANCH,25590601
942,1203,สาขาถนนท่าข้าม (พระราม 2),THANON TAKAM (RAMA 2)  BRANCH,25590601
942,1204,สาขาหนองพงนก,NONG PHONG NOK  BRANCH,25590601
942,1205,สาขาทรายมูล,SAI MUN  BRANCH,25590601
942,1206,สาขาอุ้งผาง,UMPHANG  BRANCH,25590601
942,1207,สาขาชื่นชม,CHUEN CHOM  BRANCH,25590601
942,1208,สาขาหนองแขม (เพชรเกษม 81),NONG KHAEM (PETCHKASEM 81)  BRANCH,25590601
942,1209,สาขาตลาดการเคหะ ขอนแก่น,TALAT GAAN KHEHA KHON KAEN  BRANCH,25590601
942,1210,สาขาภูพาน,PHU PHAN  BRANCH,25590601
942,1211,สาขาราชการดำเนิน,RAATCHAGAANDAMNOEN  BRANCH,25590601
942,1212,สาขาจตุรพักตรพิมาน,CHATURAPHAK PHIMAN  BRANCH,25590601
942,1213,สาขาสำโรง,SAMRONG  BRANCH,25590601
942,1214,สาขานิคมคำสร้อย,NIKHOM KHAM SOI  BRANCH,25590601
942,1215,สาขาคำตากล้า,KHAM TA KLA  BRANCH,25590601
942,1216,สาขาบ้านหนองด่าน,BANNONGDAN  BRANCH,25590601
942,1217,สาขาเหล่าเสือโก้ก,LAO SUEA KOK  BRANCH,25590601
942,1218,สาขาส่องดาว,SONG DAO  BRANCH,25590601
942,1219,สาขาสี่แยกตลาดบ้านธาตุ,SEEYAK TALAT BANTHAT  BRANCH,25590601
942,1220,สาขาถนนศรีสะเกษ - อุบลฯ,THANON SI SA KET - UBON RATCHATHANI  BRANCH,25590601
942,1221,สาขาบ้านม่วง,BAN MUANG  BRANCH,25590601
942,1222,สาขาหนองพยอม,NONG PAYOM  BRANCH,25590601
942,1223,สาขาพนมดงรัก,PHANOM DONG RAK  BRANCH,25590601
942,1224,สาขาเฉลิมพระเกียรติ,CHALOEM PHRA KIAT  BRANCH,25590601
942,1225,สาขาวังไทร,WANGSAI  BRANCH,25590601
942,1227,สาขารามคำแหง 2,RAMKHAMHAENG 2  BRANCH,25590601
942,1228,สาขากุดชุม,KUT CHUM  BRANCH,25590601
942,1229,สาขาบางงา,BANG NGA  BRANCH,25590601
942,1230,สาขาทับยา,THAP YA  BRANCH,25590601
942,1231,สาขาหลังสวน,LANG SUAN  BRANCH,25590601
942,1232,สาขาสวี,SAWI  BRANCH,25590601
942,1233,สาขาหน้าสถานีขนส่ง บขส.,NA SATAANEE KON SONG THE TRANSPORT COMPANY LIMITED  BRANCH,25590601
942,1234,สาขาสระใคร,SAKHRAI BRANCH,25590601
942,1235,สาขาสี่แยก จปร.,SEEYAK  CRMA BRANCH,25590601
942,1236,สาขาโนนแดง,NON DAENG BRANCH,25590601
942,1237,สาขาหมู่บ้านรัตนโกสินทร์ 200 ปี,MOOBAN RATTANAKOSIN 2 YEARS  BRANCH,25590601
942,1238,สาขาธัญบุรี คลอง 12,THANYABURI KHLONG 12 BRANCH,25590601
942,1239,สาขามีนบุรี,MIN BURI BRANCH,25590601
942,1240,สาขาถนนหทัยราษฎร์,THANON HATHAIRAT  BRANCH,25590601
942,1241,สาขาโชคชัย,CHOK CHAI  BRANCH,25590601
942,1242,สาขาใหม่,MAI BRANCH,25590601
942,1243,สาขาอีสเทิร์นซีบอร์ด,EASTERN SEABOARD  BRANCH,25590605
942,1244,สาขาลาดพร้าว 101,LAT PHRAO 11  BRANCH,25590605
942,1245,สาขาทิพวัล,THIPHAWAN BRANCH,25590613
942,1246,สาขาคำบ่อ (คำบิด),KHAM BO ( KHAM BIT) BRANCH,25590701
942,1247,สาขาถนนผดุงวิถี มค.,THANON PHADUNG WITHI  ( MAHA SARAKHAM) BRANCH,25590701
942,1248,สาขาบ้านชอนไพร,BAN CHON PHRAI  BRANCH,25590701
942,1249,สาขาหนองหญ้าปล้อง (เพชรบุรี),NONG YA PLONG (PHETCHABURI) BRANCH,25590701
942,1250,สาขาเข็กน้อย,KHEK NOI BRANCH,25590701
942,1251,สาขาปทุมรัตต์,PATHUM RAT BRANCH,25590701
942,1252,สาขานาข่า,NA KHA BRANCH,25590701
942,1253,สาขาบ้านหนองสระพัง,BANNONGSRAPUNG BRANCH,25590701
942,1254,สาขาท่ายาง สาย 3,THA YANG SAI 3  BRANCH,25590701
942,1255,สาขาถนนประชาสโมสร,THANONPRACHASAMOSORN   BRANCH,25590701
942,1256,สาขานาพร้าว,NA PHRAO BRANCH,25590701
942,1257,สาขาท่าอุเทน,THA UTHEN  BRANCH,25590701
942,1258,สาขาน้ำพองนอก,NAM PHONG NOK BRANCH,25590701
942,1259,สาขาสว่างวีระวงศ์,SAWANG WIRAWONG BRANCH,25590701
942,1260,สาขาหนองหมู,NONG MU BRANCH,25590701
942,1261,สาขาเทศบาลบางหลวง,TAYTSABAAN BANG LUANG  BRANCH,25590701
942,1262,สาขาทุ่งมะขามหย่อง,THUNG MAKHOM YONG BRANCH,25590701
942,1263,สาขาบ้านแพง (นครพนม),BAN PHAENG (NAKHON PHANOM) BRANCH,25590701
942,1264,สาขาพระทองคำ,PHRA THONG KHAM BRANCH,25590701
942,1265,สาขาถนนกำนันแม้น,THANONKAMNAN MAEN BRANCH,25590701
942,1266,สาขาประชาอุทิศ 90,PRACHAUTHIT 9 BRANCH,25590701
942,1267,สาขาชุมชนเนินพลับหวาน 7,CHUM CHON NAUNPUBWAN 7 BRANCH,25590701
942,1268,สาขาสามแยกวิเชียรบุรี,SAMYAEK WICHIAN BURI  BRANCH,25590701
942,1269,สาขาดอนหวาย,DON WAI  BRANCH,25590701
942,1270,สาขาแม่ขรี,MAE KHARI  BRANCH,25590701
942,1271,สาขาเขาชัยสน,KHAO CHAISON BRANCH,25590701
942,1272,สาขาบ้านเชี่ยน,BAN CHIAN BRANCH,25590701
942,1273,สาขาวัดไทร,WAT SAI BRANCH,25590701
942,1274,สาขาสะเดา,SADAO BRANCH,25590701
942,1275,สาขาคลองแงะ,KLONG NGAE BRANCH,25590701
942,1276,สาขาวังวิเศษ,WANG WISET BRANCH,25590701
942,1277,สาขาหนองตอง,NONG TONG BRANCH,25590701
942,1278,สาขาแม่แจ่ม,MAE CHAEM  BRANCH,25590701
942,1279,สาขาละแม,LAMAE BRANCH,25590701
942,1280,สาขาพรหมคีรี,PHROM KHIRI  BRANCH,25590701
942,1281,สาขาสิชล,SICHON BRANCH,25590701
942,1282,สาขาห้าแยกฉลอง,HA YAEK CHALONG BRANCH,25590701
942,1283,สาขาบ้านเซิม,BAN  SOME BRANCH,25590701
942,1284,สาขาลำสาลี,LAMSALI  BRANCH,25590701
942,1285,สาขาถนนมหาราช กระบี่,THANON MAHARAT KRABI  BRANCH,25590701
942,1286,สาขาคง,KHONG  BRANCH,25590701
942,1287,สาขาถนนเทพคุณากร,THANON  THEP KHUNAKON   BRANCH,25590701
942,1288,สาขาสายไหม,SAI MAI BRANCH,25590701
942,1289,สาขาชะอม,CHA-OM BRANCH,25590701
942,1290,สาขาตลาดคลอง 16,TARAT KHLONG 16 BRANCH,25590701
942,1291,สาขาตลาดไทยประกัน,TARAT THAI BPRA GAN BRANCH,25590712
942,1292,สาขาหนองขาหย่าง,NONG KHAYANG BRANCH,25590801
942,1293,สาขาหมู่บ้านการุณรังสี 1,MOOBAN KARUN RANGSI  BRANCH,25590801
942,1294,สาขาตลาดเทศบาลชนบท,TALAT TAYTSABAAN  CHONNABOT BRANCH,25590801
942,1295,สาขานิคมเขาบ่อแก้ว,NIKHOM KHAO BO KAEO BRANCH,25590801
942,1296,สาขานาดูน,NA DUN BRANCH,25590801
942,1297,สาขาคลองวาฬ,KHLONG WAN  BRANCH,25590801
942,1298,สาขาถนนอรรถกวี,THANONATTHA KAWI  BRANCH,25590801
942,1299,สาขาเกาะช้าง,KOH CHANG BRANCH,25590801
942,1300,สาขาคลองใหญ่,KHLONG YAI  BRANCH,25590801
942,1301,สาขาบ้านแก่งนครสวรรค์,BAN KAENG NAKHON SAWAN BRANCH,25590801
942,1302,สาขาหนองสรวง,NONG SUANG BRANCH,25590801
942,1303,สาขาโนนตาเถร,NON TA THEN BRANCH,25590801
942,1304,สาขาละโว้,LAWOE BRANCH,25590801
942,1305,สาขาสี่แยกโตโยต้า,SEEYAK TOYOTA  BRANCH,25590801
942,1306,สาขาบ้านกล้วย,BAN KLUAI  BRANCH,25590801
942,1307,สาขาบางลี่,BANG LI   BRANCH,25590801
942,1308,สาขาหนองสำโรง,NONG SAMRONG BRANCH,25590801
942,1309,สาขาชุมพร (วังไผ่),CHUMPHON (WANG PAI ) BRANCH,25590801
942,1310,สาขาคำชะอี,KHAMCHA-I BRANCH,25590801
942,1311,สาขาทับกระดาน,THAP KRADAN BRANCH,25590801
942,1312,สาขาสวายจีก,SAWAYJEEK BRANCH,25590801
942,1313,สาขาสามัคคี,SAMAKKHI   BRANCH,25590801
942,1314,สาขาบ้านเขาขาด,BAN KHAO KHAD  BRANCH,25590801
942,1315,สาขาบ้านหนองไผ่,BAN NONG PHAI  BRANCH,25590801
942,1316,สาขาเขาน้อย (ลำนารายณ์),KHAO NOI (LOMNARAI) BRANCH,25590801
942,1317,สาขาโพนยางคำ,PON YANG KHAM  BRANCH,25590801
942,1318,สาขาโพนทอง (หนองคาย),PHON THONG NONG KHAI  BRANCH,25590801
942,1319,สาขาศรีวิไล,SI WILAI BRANCH,25590801
942,1320,สาขาบุ่งคล้า(บึงกาฬ),BUNG KHLA BUENG KAN BRANCH,25590801
942,1321,สาขาบ้านดงเค็ง,BAN DONG KHEM BRANCH,25590801
942,1322,สาขาหนองเม็ก,NONG MEK BRANCH,25590801
942,1323,สาขาหมู่บ้านประปานคร,MOOBANPRAPANAKHON  BRANCH,25590801
942,1324,สาขาบ้านหลวง,BAN LUANG  BRANCH,25590801
942,1325,สาขาปลาปาก,PLA PAK BRANCH,25590801
942,1326,สาขาเขาสวนกวาง,KHAO SUAN KWANG  BRANCH,25590801
942,1327,สาขาซำสูง,SAM SUNG BRANCH,25590801
942,1328,สาขาถนนแม่น้ำแคว,THANON MAE NAAM KWAE BRANCH,25590801
942,1329,สาขาร่มแฝก,ROM FAEK BRANCH,25590801
942,1330,สาขาถนนแสงชูโต (กาญจนบุรี),THANON SANG CHUTO (KANCHANABURI) BRANCH,25590801
942,1331,สาขารัตภูมิ,RATTAPHUM  BRANCH,25590801
942,1332,สาขาชัยพฤกษ์,CHAIYAPHRUEK  BRANCH,25590801
942,1333,สาขาโกรกกราก,KROK KRAK BRANCH,25590801
942,1334,สาขาหนองแวง,NONG WAENG BRANCH,25590801
942,1335,สาขาปากพะยูน,PAK PHAYUN BRANCH,25590801
942,1336,สาขาควนขนุน,KHUAN KHANUN BRANCH,25590801
942,1337,สาขาบางแก้ว,BANG KAEO BRANCH,25590801
942,1338,สาขาสบปราบ,SOP PRAP  BRANCH,25590801
942,1339,สาขาท่าเรือ 1,THA RUEA 1 BRANCH,25590801
942,1340,สาขาท่าเริอ 2,THA RUEA 2 BRANCH,25590801
942,1341,สาขาตลาดสนามบินลำปาง,TALAD SANAMBIN LAMPANG BRANCH,25590801
942,1342,สาขาฆ้องชัย,KHONG CHAI BRANCH,25590801
942,1343,สาขาห้วยแถลง,HUAI THALAENG BRANCH,25590801
942,1344,สาขาสามแยกโคกสูง,SAMYAEK KHOK SUNG BRANCH,25590801
942,1345,สาขาตลาดบางกอกน้อย,TALAD BANGKOK NOI BRANCH,25590801
942,1346,สาขาตลาดศรีบางกรวย,TALAD SI  BANG KRUAI BRANCH,25590801
942,1347,สาขาหูช้าง,HU CHANG BRANCH,25590801
942,1348,สาขาบ้านทรายขาว กระบี่,BAN SAI KHAO KRABI BRANCH,25590801
942,1349,สาขาปะตง,PATONG BRANCH,25590801
942,1350,สาขาแก้งคร้อ,KAENG KHRO BRANCH,25590801
942,1351,สาขาบ้านโคก (หนองบัวลำภู),BAN KHOK (NONG BUA LAM PHU) BRANCH,25590801
942,1352,สาขาป่าติ้ว,PA TIO  BRANCH,25590801
942,1353,สาขาดอนจาน,DON CHAN  BRANCH,25590801
942,1354,สาขาหลัก 5,LAK 5 BRANCH,25590801
942,1355,สาขาเสนางคนิคม,SENANGKHANIKHOM BRANCH,25590801
942,1356,สาขาส้มป่อย,SOMPOI BRANCH,25590801
942,1357,สาขาเมืองใหม่,MUEANG MAI  BRANCH,25590801
942,1358,สาขาอำเภอสิเกา,AMPHOE SIKAO BRANCH,25590801
942,1359,นิคมสมุทรสาคร,NIKOM SAMUT SAKHON,25590801
942,1360,สาขาหนองแก (บ้านบึง),NONG KAE (BAN BUENG) BRANCH,25590801
942,1361,สาขาแก้งสนามนาง,KAENG SANAM NANG  BRANCH,25590801
942,1362,สาขาดอนสัก,DON SAK BRANCH,25590801
942,1363,สาขาตลาดพระเนตร,TALAD PHRA NET BRANCH,25590801
942,1364,สาขาสันติสุข,SANTI SUK BRANCH,25590801
942,1365,สาขาพิบูลย์รักษ์,PHIBUN RAK BRANCH,25590801
942,1366,สาขาเวียงกุมกาม,WIANG KUM KAM BRANCH,25590801
942,1367,สาขาตลาดพูนทรัพย์,TALAD POONSUP  BRANCH,25590801
942,1368,สาขาไชยา,CHAIYA  BRANCH,25590801
942,1369,สาขาปะโค,PA KHO BRANCH,25590801
942,1370,สาขาลาดใหญ่,LAT YAI  BRANCH,25590801
942,1371,สาขาน้ำหนาว,NAM NAO BRANCH,25590801
942,1372,สาขาทุ่งตะโก,THUNG TAKO BRANCH,25590801
942,1373,สาขาตลาดบ้านติ้ว,TALAD BAN TIO BRANCH,25590801
942,1374,สาขาเกาะสิเหร่,KOH SIRAY  BRANCH,25590801
942,1375,สาขาควนเนียง,KHUAN NIANG BRANCH,25590801
942,1376,สาขาตลาดเกษตรทุ่งสง,TALAD GASAY TTHUNG SONG BRANCH,25590801
942,1377,สาขา 5 แยกเกาะยอ,5 YAK KOH YOR BRANCH,25590801
942,1378,สาขาถนนบรบือ - นาเชือก,TANON BORABUE - NA CHUEAK,25590901
942,1379,ถนนนาเชือก-เขวาไร่,TANON NA CHUEAK - KHWAO RAI,25590901
942,1380,สาขาบ้านเบิก,BAN BOEK BRANCH,25590901
942,1381,สาขาชะอวด,CHA-UAT BRANCH,25590901
942,1382,สาขาบัวทองเคหะ,BUA THONG KHEHA   BRANCH,25590901
942,1383,สาขาขามเรียง,KHAM RIANG    BRANCH,25590901
942,1384,สาขาบ้านส่อง,BAN SONG   BRANCH,25590901
942,1385,สาขาศรีชมชื่น,SI CHOM CHUEN BRANCH,25590901
942,1386,สาขาบ้านสามเหลี่ยม (อด.),BAN SI LIAM (UDON THANI) BRANCH,25590901
942,1387,สาขาเคียนซา,KHIAN SA BRANCH,25590901
942,1388,สาขาหน้าค่ายสีหราชเดโชชัย,NA   KAI SIHARAT DE CHO CHAI BRANCH,25590901
942,1389,สาขาค้อวัง,KHO WANG BRANCH,25590901
942,1390,สาขากม.18,KM. 18 BRANCH,25590901
942,1391,สาขาบ่อรัง,BO RANG BRANCH,25590901
942,1392,สาขาสำเพ็ง 2 (ถนนกัลปพฤกษ์),SAMPENG 2  (THANON KANLAPAPHRUEK) BRANCH,25590901
942,1393,สาขาหมู่บ้าน ดี .เค. (บางบอน),MOOBAN D.K. ( BANG BON) BRANCH,25590901
942,1394,สาขาโคกสลุง,KHOK SALUNG BRANCH,25590901
942,1395,สาขาซอยมังกร,MANGKON  BRANCH,25590901
942,1396,สาขาทับปุด,THAP PUT BRANCH,25590901
942,1397,บ้านลานสะเดา,BAN LAN SADAO,25590901
942,1398,สาขาถนนมิตรภาพ -ศิลา,TANON MITTRAPRAP - SILAA BRANCH,25590901
942,1399,สาขาบ้านสว่าง,BAN SAWANG  BRANCH,25590901
942,1400,สาขาหน้าราชภัฎบุรีรัมย์,NA RADPAT  BURI RAM  BRANCH,25590901
942,1401,สาขาไชยราช,CHAIYARAT BRANCH,25590901
942,1402,สาขาบ่อไร่,BO RAI BRANCH,25590901
942,1403,สาขาบ้านนาจารย์,BAN NA CHAN BRANCH,25590901
942,1404,สาขาตลาดไทศิริ 1,TALAD THAI SIRI 1 BRANCH,25590901
942,1405,สาขาผดุงพานิช,PADUNGPANIT BRANCH,25590901
942,1406,สาขาเพชรเกษม 75,PHET KASEM 75 BRANCH,25590901
942,1407,สาขาถนนเลียบคลองภาษีเจริญฝั่งใต้,TANON LIAP KHLONG PHASI CHAROEN FANG TAI  BRANCH,25590901
942,1408,สาขาสามแยกชลประทาน,SAM YAEK CHONLAPRATHAN  BRANCH,25590901
942,1409,สาขาบางคนที,BANG KHONTHI BRANCH,25590901
942,1410,สาขาวังซอง,WANGSONG  BRANCH,25590901
942,1411,สาขาบ้านเพชร,BAN PHET BRANCH,25590901
942,1412,สาขาศรีรัตนะ,SI RATTANA BRANCH,25590901
942,1413,สาขาสี่แยกศรีสะอาด,SEEYAK SI SAAT  BRANCH,25590901
942,1414,สาขาตลาดหนองฉาง,TALAD NONG CHANG BRANCH,25590901
942,1415,สาขามอพอคอ,MOR POR KOR BRANCH,25590901
942,1416,สาขาแวงใหญ่,WAENG YAI BRANCH,25590901
942,1417,สาขาบ้านนาเหมือง (พังโคน),BAN NA MUEANG (PHANG KHON) BRANCH,25590901
942,1418,สาขาถนนเสลภูมิ - โพนทอง,TANON SELAPHUM - PHON THONG BRANCH,25590901
942,1419,สาขาตลาดบึงกาฬ,TALAD BUENG KAN BRANCH,25590901
942,1420,สาขาถนนอรัญประเทศ - ตาพระยา,TANON ARANYAPRATHET - TA PHRAYA  BRANCH,25590901
942,1421,สาขาบึงบัว,BUNG BUA  BRANCH,25590901
942,1422,สาขาทองเลื่อน,TONGLEUAN BRANCH,25590901
942,1423,สาขาวังขอน,WANG KHON BRANCH,25590901
942,1424,สาขาห้วยเกิ้ง,HUAI KOENG BRANCH,25590901
942,1425,สาขาห้วยใหญ่ (เพชรบูรณ์),HUAI YAI (PHETCHABUN) BRANCH,25590901
942,1426,สาขาเมืองสรวง,MUEANG SUANG BRANCH,25590901
942,1427,สาขานิคมราชบุรี,NIKOM RATCHABURI BRANCH,25590901
942,1428,สาขาบ้านหนองหลวง,BAN NONG LUANG BRANCH,25590901
942,1429,สาขาโรงงานน้ำตาลมิตรผล,ROHNG NGAAN SUGAR MITR PHOL  BRANCH,25590901
942,1430,สาขาโพรงมะเดื่อ,PHRONG MADUEA BRANCH,25590901
942,1431,สาขานนทบุรี,NONTHABURI BRANCH,25590901
942,1432,สาขาวนารมย์,WANAROM  BRANCH,25590901
942,1433,สาขาตลาดเสริมสุข,TALAD SERM SUK BRANCH,25590901
942,1434,สาขาดงแคนใหญ่,DONG KHAEN YAI BRANCH,25590901
942,1435,สาขาแบริ่ง,BEARING BRANCH,25590901
942,1436,สาขาลำทับ,LAM THAP  BRANCH,25590901
942,1437,สาขาแม่สูน,MAE SUN BRANCH,25590901
942,1438,สาขาหนองตะไก้,NONG TAKAI BRANCH,25590901
942,1439,สาขานิคมบ้านกรวด,NIKOM BAN KRUAT BRANCH,25590901
942,1440,สาขาท่าโป่ง,TAA BPOHNG BRANCH,25590901
942,1441,สาขาโคกสวาย,KHOK SAWAI BRANCH,25590901
942,1442,สาขาท่าฉนวน,THA CHANUAN BRANCH,25590901
942,1443,สาขาตลาดพยัคฆภูมิพิสัย,TALAD PHAYAKKHAPHUM PHISAI BRANCH,25590901
942,1444,สาขาไพรขลา,PHRAI KHLA BRANCH,25590901
942,1445,สาขาบ้านโรงเลื่อย,BAN RONG LUEAI BRANCH,25590901
942,1446,สาขาตลาดอิคิวซัง ( ถ.บางกรวย - ไทรน้อย),TALAD IKKYU SAN (THANON BANG KRUAI - SAI NO) BRANCH,25590901
942,1447,สาขาเขวาสินรินทร์,KHWAO SINARIN BRANCH,25590901
942,1448,สาขาปรางค์กู่,PRANG KU BRANCH,25590901
