FI_CODE,FI_BRANCH,FI_NAME_THAI,FI_NAME_ENG,OPEN_DATE
014,0330,สาขาคลอง 2 (ธัญบุรี),KHLONG 2 (THANYABURI) BRANCH,25350117
014,0331,สาขาบางนาทาวเวอร์,BANGNA TOWER  BRANCH,25350320
014,0333,สาขามหาวิทยาลัยมหิดล,MAHIDOL UNIVERSITY  BRANCH,25360430
014,0334,สาขาตลาดดวงแก้ว (ถนนติวานนท์),TALADDUANGKAEO (THANONTIWANON) BRANCH,25361112
014,0335,สาขาถนนสุขุมวิท (สมุทรปราการ),THANON SUKHUMWIT(SAMUT PRAKAN) BR.,25361126
014,0337,สาขาถนนศรีสมุทร (สมุทรปราการ),THANON SI SAMUT (SAMUT PRAKAN) BRANCH,25361115
014,0338,สาขาบางปู (สมุทรปราการ),BANGPU (SAMUTPRAKAN) BRANCH,25370617
014,0339,สาขาบางบ่อ (สมุทรปราการ),BANG BO (SAMUT PRAKAN)  BRANCH,25370630
014,0340,สาขากระทรวงสาธารณสุข,MINISTRY OF PUBLIC HEALTH  BRANCH,25370930
014,0341,สาขาถนนนครเขื่อนขันธ์ (สมุทรปราการ),THANON NAKHON KHUANKHAN BRANCH,25371111
014,0342,สาขาซอยวัดบัวขวัญ (นนทบุรี),SOI WAT BUA KHWAN  BRANCH,25380428
014,0343,สาขาถนนปู่เจ้าสมิงพราย,THANON PU CHAO SAMING PHRAI BRANCH,25380224
014,0344,สาขาวัดศรีประวัติ (นนทบุรี),WAT SI PRAWAT(NONTHABURI)  BRANCH,25380818
014,0345,สาขาประตูน้ำพระอินทร์,PHATUNAM PHRA IN BRANCH,25380901
014,0346,สาขาถนนเทพารักษ์ (อาคารมาลีรมย์),THANONTHEPHARAK (MALEEROM TOWER) BRANCH,25380929
014,0347,สาขาถนนกิ่งแก้ว (อ่อนนุช),THANON KING KAEO(ON NUCH) BRANCH,25381027
014,0348,สาขาถนนรัตนาธิเบศร์,THANON RATTANA THIBET BRANCH,25381229
014,0349,สาขารังสิต (ปทุมธานี),RANG SIT (PATHUM THANI) BRANCH,25390126
014,0350,สาขาลาดหลุมแก้ว,LAT LUM KAEO BRANCH,25390719
014,0351,สาขาคูคต (คลอง 2),KHU KOT (KHLONG 2),25390809
014,0352,สาขาบางบัวทอง,BANG BUATHONG,25391227
014,0353,สาขาถนนศรีนครินทร์ (ลาซาล),THANON SI NAKARIN (SOI LAZAL) BRANCH,25400307
014,0354,สาขาถนนนิมิตใหม่,THANON NIMITRMAI BRANCH,25410925
014,0355,สาขาบางครุ(พระประแดง),BANG KHRU (PHRA PRADAENG) BRANCH,25420514
014,0356,สาขานิคมอุตสาหกรรมบางปู 2,BANG PU INDUSTRIAL ESTATE 2 BRANCH,25450405
014,0357,สาขาเดอะมอลล์ งามวงศ์วาน,THE MALL NGAM WONG WAN BRANCH,25461209
014,0360,สาขาฟิวเจอร์พาร์ค รังสิต,FUTURE PARK RANGSIT BRANCH,25470813
014,0361,สาขาบิ๊กซี สมุทรปราการ,BIC C SAMUTPRAKARN BRANCH,25471112
014,0364,สาขาเซียร์ รังสิต,ZEER RANGSIT BRANCH,25480331
014,0365,สาขาเซ็นทรัลพลาซา รัตนาธิเบศร์,CENTRAL PLAZA RATTANATHIBET BRANCH,25480422
014,0366,สาขาบิ๊กซี อ้อมใหญ่,BIG C OMYAI BRANCH,25480504
014,0368,สาขาเทสโก้ โลตัส รังสิต-นครนายก,TESCO LOTUS RANGSIT-NAKHONNAYOK BRANCH,25480601
014,0370,สาขาเทสโก้ โลตัส รังสิต,TESCO LOTUS RANGSIT BRANCH,25480725
014,0371,สาขาไทยธานี (นวนคร-ปทุมธานี),THAITHANI (NAWANAKHON-PATHUMTHANI) BRANCH,25480725
014,0372,สาขาตลาดพูนทรัพย์ (ปทุมธานี),POONSAB MARKET (PATHUMTHANI) BRANCH,25480630
014,0374,สาขาท่าน้ำนนทบุรี,THANAMNONTHABURI BRANCH,25480726
014,0376,สาขาบิ๊กซี แจ้งวัฒนะ 2,BIT C CHAENGWATTHANA 2 BRANCH,25480908
014,0380,สาขาโฮมโปร สุวรรณภูมิ,HOMEPRO SUVARNABHUMI BRANCH,25481109
014,0381,สาขาท่าอิฐ (นนทบุรี),THA IT (NONTHABURI) BRANCH,25481130
014,0382,สาขาบิ๊กซี ติวานนท์,BIG C TIWANON BRANCH,25481130
014,0383,สาขาฟิวเจอร์ พาร์ค รังสิต 2,FUTURE PARK RANGSIT 2  BRANCH,25481226
014,0385,สาขาตลาดไท,THAI MARKET BRANCH,25481227
014,0386,สาขาถนนกาญจนาภิเษก (บ้านบัวทอง),THANONKARNCHANAPISEK (BANBUATHONG) BRANCH,25490427
014,0387,สาขาบางใหญ่ (วัดคงคา),BANGYAI (WATKHONGKHA) BRANCH,25490524
014,0388,สาขาพันธุ์ทิพย์ พลาซ่า งามวงศ์วาน,PANTIP PLAZA (NGAMWONGWAN) BRANCH,25490628
014,0390,สาขาเทพารักษ์ กม.16,THEPHARAK KM.16 BRANCH,25491013
014,0391,สาขาถนนพุทธมณฑลสาย 4,THANONPUTTHAMONTHONSAI 4 BRANCH,25490830
014,0392,สาขาเทสโก้ โลตัส บ้านฟ้าลำลูกกา,TESCO LOTUS BANFALAMLUKKA BRANCH,25490829
014,0393,สาขาท่าอากาศยานสุวรรภูมิ 2 E,SUVARNABHUMI 2 E AIRPORT BRANCH,25490901
014,0395,สาขาท่าอากาศยานสุวรรณภูมิ 3 M,SUVARNABHUMI 3 M AIRPORT BRANCH,25490918
014,0397,สาขาท่าอากาศยานสุวรรณภูมิ 6 W,SUVARNABHUMI 6 W AIRPORT BRANCH,25490918
014,0399,สาขาบิ๊กซี บางพลี,BIG C BANGPHLI BRANCH,25490905
014,0501,สาขาท่าแพ,THA PHAE BRANCH,24700101
014,0502,สาขาลำปาง,LAMPANG BRANCH,24730602
014,0503,สาขานครราชสีมา,NAKHON RATCHASIMA BRANCH,24860514
014,0504,สาขาเพชรบุรี,PHETCHABURI BRANCH,24970305
014,0505,สาขาชลบุรี,CHON BURI BRANCH,24980109
014,0506,สาขานครสวรรค์,NAKHON SAWAN BRANCH,25001205
014,0507,สาขาเชียงราย,CHIANG RAI BRANCH,25010720
014,0508,สาขายะลา,YALA BRANCH,25050326
014,0509,สาขาหาดใหญ่,HAT YAI BRANCH,25050329
014,0510,สาขาอุดรธานี,UDON THANI BRANCH,25050409
014,0511,สาขาขอนแก่น,KHON KAEN BRANCH,25050412
014,0512,สาขาตรัง,TRANG BRANCH,25171125
014,0513,สาขาทุ่งสง,THUNG SONG BRANCH,25171128
014,0514,สาขาจันทบุรี,CHANTHABURI BRANCH,25171224
014,0515,สาขาสมุทรสงคราม,SAMUT SONGKHRAM BRANCH,25171230
014,0516,สาขาฉะเชิงเทรา,CHACHOENGSAO BRANCH,25180422
014,0517,สาขาศรีเทพ,SRITHEP BRANCH,25180822
014,0518,สาขาแพร่,PHRAE BRANCH,25181002
014,0519,สาขานครปฐม,NAKHON PATHOM BRANCH,25181218
014,0520,สาขาอำนาจเจริญ,AMNAT CHAROEN BRANCH,25190108
014,0521,สาขาจอมบึง,CHOM BUNG BRANCH,25190109
014,0522,สาขาดอนเจดีย์,DON CHEDI BRANCH,25190113
014,0523,สาขาระยอง,RAYONG BRANCH,25190224
014,0524,สาขาลูกแก,LUK KAE BRANCH,25190318
014,0525,สาขาสิชล,SICHON BRANCH,25190402
014,0526,สาขาสีคิ้ว,SIKHIU BRANCH,25190409
014,0527,สาขาศรีราชา,SIRACHA BRANCH,25190524
014,0528,สาขาวังสะพุง,WANG SAPHUNG BRANCH,25190528
014,0529,สาขาพนัสนิคม,PHANAT NIKHOM BRANCH,25190618
014,0530,สาขาอุบลราชธานี,UBON RATCHATHANI BRANCH,25190705
014,0531,สาขาโกสุมพิสัย,KOSUM PHISAI BRANCH,25190820
014,0532,สาขาประตูเชียงใหม่,PRATU CHEANGMAI BRANCH,25190910
014,0533,สาขาตลาดย่านยาว,TALAT YAN YAO BRANCH,25191008
014,0534,สาขาจัตุรัส,CHATTURAT BRANCH,25191029
014,0535,สาขาพัทยา,PHATTAYA BRANCH,25191105
014,0536,สาขาสุโขทัย,SUKHOTHAI BRANCH,25191217
014,0537,สาขาภูเก็ต,PHUKET BRANCH,25191224
014,0538,สาขาหนองบัวลำภู,NONG BUA LAM PHU BRANCH,25200107
014,0539,สาขาจอมทอง,CHOM THONG BRANCH,25200121
014,0540,สาขาดำเนินสะดวก,DAMNOEN SADUAK BRANCH,25200128
014,0541,สาขาไชยา,CHAIYA BRANCH,25200422
014,0542,สาขาทานพอ,THAN PHO BRANCH,25200426
014,0543,สาขาตลาดเขต,TALAT KHET BRANCH,25200429
014,0544,สาขาภาชี,PHACHI BRANCH,25200520
014,0545,สาขาเวียงป่าเป้า,WIANG PA PAO BRANCH,25200527
014,0546,สาขาเสลภูมิ,SELAPHUM BRANCH,25200726
014,0547,สาขาสกลนคร,SAKON NAKHON BRANCH,25200826
014,0549,สาขาศรีนครพิงค์,SRI NAKORN PING BRANCH,25210421
014,0550,สาขาประตูช้างเผือก,PRATU CHANG PHUAK BRANCH,25210424
014,0551,สาขามหาวิทยาลัยขอนแก่น,KHON KAEN UNIVERSITY BRANCH,25210508
014,0552,สาขาสุราษฎร์ธานี,SURAT THANI BRANCH,25210526
014,0553,สาขานครศรีธรรมราช,NAKHON SI THAMMARAT BRANCH,25210529
014,0554,สาขาสงขลา,SONGKHLA BRANCH,25210602
014,0555,สาขาหล่มสัก,LOM SAK BRANCH,25210901
014,0556,สาขาสวรรคโลก,SAWANKHALOK BRANCH,25210922
014,0557,สาขาศรีสะเกษ,SI SA KET BRANCH,25211027
014,0558,สาขาอุทัยธานี,UTHAI THANI BRANCH,25211215
014,0559,สาขาสุรินทร์,SURIN BRANCH,25220330
014,0560,สาขาสิงห์บุรี,SING BURI BRANCH,25220420
014,0561,สาขายโสธร,YASOTHON BRANCH,25220427
014,0562,สาขาร้อยเอ็ด,ROI ET BRANCH,25220727
014,0563,สาขาสระบุรี,SARABURI BRANCH,25220824
014,0564,สาขานาเฉลียง,NA CHALIANG BRANCH,25220907
014,0565,สาขามหาวิทยาลัยสงขลานครินทร์,PRINCE OF SONGKHLA UNIVERSITY BRANC,25221206
014,0566,สาขาคณะแพทยศาสตร์เชียงใหม่,FACULTY OF MEDECINE BRANCH,25221214
014,0567,สาขาบ้านนา,BAN NA BRANCH,25230704
014,0569,สาขาพิษณุโลก,PHITSANULOK BRANCH,25230926
014,0570,สาขาสมุทรสาคร,SAMUT SAKHON BRANCH,25231003
014,0571,สาขาราชบุรี,RATCHABURI BRANCH,25231219
014,0572,สาขากระบี่,KRABI BRANCH,25240410
014,0573,สาขาแม่สอด,MAE SOT BRANCH,25240724
014,0574,สาขาบางปะอิน,BANG PA-IN BRANCH,25241106
014,0575,สาขาอยุธยา,AYUTTHAYA BRANCH,25241120
014,0576,สาขาหลักห้า,LAK HA BRANCH,25250820
014,0577,สาขาคลอง 16,KHLONG 16 BRANCH,25251029
014,0578,สาขากาฬสินธุ์,KALASIN BRANCH,25251126
014,0579,สาขาลพบุรี,LOP BURI BRANCH,25251224
014,0580,สาขาถนนมุขมนตรี (นครราชสีมา),THANON MUKKHAMONTRI BRANCH,25260408
014,0581,สาขาระนอง,RANONG BRANCH,25261014
014,0582,สาขาบางปลาสร้อย,BANG PLASOI BRANCH,25261223
014,0583,สาขาวารินชำราบ,WARIN CHAMRAP BRANCH,25270113
014,0584,สาขาลำพูน (ป่าเห็ว),LAMPHUN (PA HEO) BRANCH,25270323
014,0585,สาขากำแพงเพชร,KAMPHAENG PHET BRANCH,25270504
014,0587,สาขาถนนโพศรี (อุดรธานี),THANON PHO SI (UDON THANI) BRANCH,25280118
014,0588,สาขาปราจีนบุรี,PRACHIN BURI BRANCH,25280315
014,0589,สาขาท่าโขลง,THA KHONG BRANCH,25281101
014,0590,สาขาหาดใหญ่ใน,HAD YAI NAI BRANCH,25281115
014,0591,สาขาสุพรรณบุรี,SUPHAN BURI BRANCH,25290307
014,0592,สาขาศรีมหาโพธิ,SRIMAHAPHO BRANCH,25290404
014,0593,สาขารัตนบุรี (สุรินทร์),RATTANA BURI BRANCH,25290418
014,0594,สาขาอุตรดิตถ์,UTHARADIT BRANCH,25290502
014,0595,สาขาบางแพ (ราชบุรี),BANG PHAE BRANCH,25290516
014,0596,สาขาแม่โจ้,MAE JOH BRANCH,25290523
014,0597,สาขาเพชรบูรณ์,PETCHABOON BRANCH,25290627
014,0600,สาขาชัยภูมิ,CHAIYAPOOM BRANCH,25291204
014,0601,สาขาป่าตอง (ภูเก็ต),PATONG BRANCH,25291226
014,0602,สาขาห้วยแถลง (นครราชสีมา),HUAI THALAENG BRANCH,25300109
014,0603,สาขาบุรีรัมย์,BURI RAM BRANCH,25300123
014,0604,สาขานครพนม,NAKHON PHANOM BRANCH,25300327
014,0605,สาขาองครักษ์ (นครนายก),AONGKALUK BRANCH,25300403
014,0606,สาขาท่าเรือ (อยุธยา),THA RUA (AYUTTHAYA) BRANCH,25300529
014,0607,สาขากาญจนบุรี,KANCHANABURI BRANCH,25300710
014,0608,สาขามหาสารคาม,MAHA SARAKHAM BRANCH,25300828
014,0609,สาขาปัตตานี,PATANE BRANCH,25301002
014,0610,สาขายางตลาด (กาฬสินธุ์),YANG TALAT (KALASIN) BRANCH,25301009
014,0611,สาขาบ้านโป่ง (ราชบุรี),BAN PONG (RATCHABURI) BRANCH,25301204
014,0612,สาขาปราณบุรี,PRANBURI BRANCH,25310226
014,0613,สาขาสะพานเดชาติวงศ์,SAPHAN DECHATIWONG (NAKHONSAWAN),25310311
014,0614,สาขาโคกสำโรง (ลพบุรี),KHOK SAMRONG (LOP BURI) BRANCH,25310325
014,0615,สาขาชัยนาท,CHAI NATH BRANCH,25310408
014,0616,สาขาบางมูลนาก,BANGMOONNARK BRANCH,25310527
014,0617,สาขาสตูล,SATOON BRANCH,25310728
014,0619,สาขาบ้านบึง,BANBUNG BRANCH,25310909
014,0620,สาขาตะพานหิน,TAPHAN-HIN BRANCH,25311209
014,0621,สาขาขนอม,KANON BRANCH,25311223
014,0622,สาขาปากช่อง (นครราชสีมา),PAK CHONG  (NAKHON RATCHASIMA) BRANCH,25311230
014,0623,สาขาเกาะสมุย,KOA SAMUY BRANCH,25320317
014,0624,สาขาหนองคาย,NONG-KAY BRANCH,25320728
014,0625,สาขาตราด,TRAT BRANCH,25320915
014,0626,สาขาจอมเทียน,CHOM THIEAN BRANCH,25321124
014,0627,สาขาอ่างทอง,ANGTHONG BRANCH,25321222
014,0628,สาขาเพ็ญ,PHEN BRANCH,25330202
014,0630,สาขาละแม,LAMAE (CHUMPORN) BRANCH,25380828
014,0631,สาขาคลองใหญ่,KLONG YAI BRANCH,25330330
014,0633,สาขาถนนเจ้าฟ้า (ภูเก็ต),THANON CHAO-FA BRANCH,25330608
014,0634,สาขาแกลง,GLANG BRANCH,25330706
014,0635,สาขาบางพระ,BANGPRA SUB BRANCH,25400203
014,0636,สาขาแม่สาย,MAE SAI BRANCH,25330824
014,0639,สาขาเชียงแสน,CHIANG SAEN BRANCH,25331019
014,0640,สาขาบางแสน,BANG SAEN BRANCH,25331026
014,0641,สาขาชนบท,CHONABOT BRANCH,25331102
014,0642,สาขานาเกลือ,NA KLUA  BRANCH,25331109
014,0644,สาขามาบตาพุด,MAPTAPHUT BRANCH,25331214
014,0646,สาขาโนนสะอาด,NON SA-AT BRANCH,25340118
014,0647,สาขาชุมแพ,CHUM PHAE BRANCH,25340301
014,0648,สาขาเลย,LOEI BRANCH,25340329
014,0649,สาขาพระประโทน (นครปฐม),PHRA PRATHON(NAKHON PATHOM) BRANCH,25341018
014,0650,สาขาพิจิตร,PHICHIT BRANCH,25341108
014,0652,สาขามุกดาหาร,MUKDAHAN BRANCH,25341206
014,0653,สาขาแหลมฉบัง,LAEM CHABANG BRANCH,25341213
014,0654,สาขาชุมพร,CHUMPHON BRANCH,25341220
014,0655,สาขานราธิวาส,NARATHIWAT BRANCH,25350410
014,0656,สาขาสัตหีบ,SATTAHIP BRANCH,25350430
014,0657,สาขาเกาะพะงัน,KO PHANGAN  BRANCH,25350504
014,0658,สาขาพัทลุง,PHATTHALUNG BRANCH,25350508
014,0659,สาขานครนายก,NAKHON NAYOK BRANCH,25350522
014,0660,สาขาถนนเมืองสมุทร (เชียงใหม่),THANON MUANG SAMUT(CHIANG MAI) BRANCH,25351009
014,0662,สาขาสุไหงโก-ลก,SUNGAI KOLOK BRANCH,25351113
014,0663,สาขาถนนท่ามะนาว (ลำนารายณ์),THANON THAMANAO(LAMNARAI)  BRANCH,25351127
014,0664,สาขาสี่แยกสันกำแพง (หนองป่าครั่ง),SI YAEK SANKAMPHAENG (NONGPHAKRUNG) BRANCH,25351218
014,0665,สาขาปักธงชัย,PAK THONG CHAI BRANCH,25360217
014,0666,สาขาถนนมิตรภาพ (นครราชสีมา),THANON MITTRAPHAP(NAKHON RATCHASIMA,25360219
014,0667,สาขามหาวิทยาลัยเชียงใหม่,CHIANG MAI UNIVERSITY  BRANCH,25360226
014,0668,สาขาปากพนัง,PAK PHANANG BRANCH,25360312
014,0669,สาขาพัทยาสาย 2,PHATTAYA SAI 2 BRANCH,25360319
014,0670,สาขาบ้านสร้าง,BAN SANG BRANCH,25360326
014,0672,สาขาตลาดบ่อบัว (ฉะเชิงเทรา),TALAT BO BUA(CHACHOENGSAO) BRANCH,25360514
014,0674,สาขาด่านมะขามเตี้ย,DAN MAKHAM TIA BRANCH,25360819
014,0675,สาขาท่าหลวง (ลพบุรี),THA LUANG(LOP BURI) BRANCH,25360910
014,0676,สาขาหนองแค,NONG KHAE BRANCH,25360903
014,0677,สาขาบ้านดู่ (เชียงราย),BAN DU(CHAING RAI) BRANCH,25360917
014,0678,สาขาสองพี่น้อง,SONG PHI NONG BRANCH,25361105
014,0679,สาขาสังขละบุรี,SANGKHLA BURI BRANCH,25361015
014,0682,สาขาฝาง,FANG BRANCH,25361203
014,0683,สาขาด่านช้าง (สุพรรณบุรี),DAN CHANG(SUPANBURI) BRANCH,25361209
014,0685,สาขาหนองหิน (ภูกระดึง),NONG HIN (PHUKRADUNG) BRANCH,25370202
014,0686,สาขาบางปะกง,BANG PAKONG BRANCH,25370304
014,0687,สาขาแก่งคอย,KAENG KHOI BRANCH,25370325
014,0688,สาขานิคมอุตสาหกรรมสหพัฒนพิบูล (ชลบุรี),SAHA GROUP INDUSTRAIL PARK (CHON BURI) BRANCH,25370408
014,0689,สาขามหาชนะชัย,MAHA CHANA CHAI BRANCH,25370422
014,0690,สาขาถนนรัถการ (หาดใหญ่),THANON RATTHAKAN(HATYAI) BRANCH,25370511
014,0691,สาขาสามแยกสำโรง (สงขลา),SAM YAEK SAMRONG(SONGKHLA) BRANCH,25370513
014,0692,สาขากบินทร์บุรี,KABIN BURI BRANCH,25370520
014,0693,สาขาโพธาราม,PHOTHARAM BRANCH,25370527
014,0694,สาขาวงเวียนสระแก้ว (ลพบุรี),WONGWIAN SA KAEC(LOP BURI)  BRANCH,25370624
014,0696,สาขาพนมสารคาม,PHANOM SARAKHAM BRANCH,25370729
014,0697,สาขาสบปราบ,SOP PRAP BRANCH,25370819
014,0698,สาขาท่ามะเขือ (คลองขลุง),THA MAKHUA BRANCH,25370826
014,0699,สาขาประจวบคีรีขันธ์,PRACHUAP KHIRI KHAN BRANCH,25370902
014,0700,สาขาบางคล้า,BANG KHLA BRANCH,25370909
014,0701,สาขาพัฒนานิคม (ลพบุรี),PHATTHANA NIKHOM(LOPBURI) BRANCH,25371021
014,0702,สาขานาก่วม (ลำปาง),NAKUAM (LAMPANG) BRANCH,25371028
014,0703,สาขาซอยสาครพิทักษ์ (ชลบุรี),SOI SAKHON PHITHAK(CHONBURI) BRANCH,25371118
014,0704,สาขาสงขลานครินทร์ (ปัตตานี),PRINCE OF SONGKHLA(PATANI) BRANCH,25371125
014,0706,สาขาเชิงทะเล (ภูเก็ต),CHOENG THALE (PHUKET)  BRANCH,25371221
014,0707,สาขามหาวิทยาลัยเทคโนโลยีสุรนารี,SURANAREE UNI.OF TECHNOLOGY BRANCH,25380127
014,0708,สาขาท่ายาง (เพชรบุรี),THA YANG (PETCHABURI) BRANCH,25380210
014,0709,สาขาชะอำ,CHA-AM BRANCH,25380208
014,0710,สาขาจอหอ,CHOHO (NAKHON RAT) BRANCH,25380217
014,0711,สาขาตลาดหัวอิฐ (นครศรีธรรมราช),TALAT HUA IT(NAKHON SI) BRANCH,25380303
014,0712,สาขาอู่ทอง,U THONG BRANCH,25380317
014,0713,สาขาท่าทราย (สมุทรสาคร),THA SAI (SAMUT SAKHON)  BRANCH,25380120
014,0714,สาขาถนนโชตนา (เชียงใหม่),THANON CHOTANA(CHIANG MAI) BRANCH,25380331
014,0718,สาขาถนนตรีรัตน์ (จันทบุรี),THANON TRI RATANA (CHANTHABURI),25380609
014,0719,สาขาอรัญประเทศ,ARANYAPRATHET BRANCH,25380714
014,0720,สาขาพรหมคีรี,PHROMMAKHIRI BRANCH,25380825
014,0721,สาขาถนนทหาร (อุดรธานี),THANON THAHAN (UDON THANI) BRANCH,25380915
014,0722,สาขาบางสะพาน,BANG SAPHAN BRANCH,25380922
014,0724,สาขาบ้านอำเภอ (สัตหีบ),BAN AMPHOE(SATTAHIP) BRANCH,25381006
014,0725,สาขาหนองบุญมาก (นครราชสีมา),NONG BUN MAK (NAKHONRACHASIMA) BRANCH,25381101
014,0726,สาขาถนนพิชัยรณรงค์สงคราม (สระบุรี),THANONPICHAI(SARABURI) BRANCH,25381110
014,0727,สาขาบ้านพรุ (หาดใหญ่),BAN PHRU (HAT YAI) BRANCH,25381122
014,0728,สาขาหินกอง (สระบุรี),HIN KONG(SARABURI) BRANCH,25381129
014,0729,สาขาสี่แยกมะลิวัลย์ (ขอนแก่น),SI YAEK MALIWAN(KHONKAEN) BRANCH,25381208
014,0730,สาขาห้าแยกโคกมะตูม (พิษณุโลก),HA YAEK KHOKMATUM(PHITSANULOK) BR.,25381215
014,0731,สาขาโรงพยาบาลแมคคอร์มิค (เชียงใหม่),MCCORMICK HOSPITAL(CHIANG MAI) BRANCH,25381220
014,0732,สาขาน่าน,NAN BRANCH,25381222
014,0733,สาขาตาคลี,TAKHLI BRANCH,25390105
014,0734,สาขาสันป่าตอง (เชียงใหม่),SAN PA TONG (CHIANG MAI) BRANCH,25390112
014,0735,สาขากมลาไสย (กาฬสินธุ์),KAMALASAI (KALASIN) BRANCH,25390119
014,0737,สาขาห้าแยกฉลอง (ภูเก็ต),HAYAEKCHALONG(PHUKET) BRANCH,25390524
014,0738,สาขาสระแก้ว,SAKAEO,25390607
014,0739,สาขาวังน้อย,WANGNOI BRANCH,25390621
014,0740,สาขากันทรลักษ์ (ศรีสะเกษ),KANTHARALAK(SISAKET),25390705
014,0741,สาขาคลองรั้ง (ศรีมหาโพธิ),KHONGRANG(SIMAHAPHOT),25430815
014,0743,สาขาน้ำพอง,NAMPHONG,25390830
014,0744,สาขาตาก,TAK,25390920
014,0745,สาขาถนนเจริญราษฎร์ (ลำพูน),THANONCHAROENRAT(LUMPHUN) BRANCH,25390923
014,0746,สาขาเชียงของ,CHIANGKHONG,25390925
014,0747,สาขาสี่แยกแม่กรณ์ (เชียงราย),SIYAEKMAEKORN(CHIANGRAI),25390927
014,0748,สาขาสหัสขันธ์ (กาฬสินธุ์),SAHATSAKHAN(KALASIN),25391016
014,0749,สาขาบ้านไผ่,BANPHAI,25391018
014,0750,สาขาสี่แยกหัวถนน (นครศรีธรรมราช),SIYAEKHUATHANON(NAKHONSITHAMMARAT),25391113
014,0751,สาขาถนนกาญจนวิถี (สุราษฎร์ธานี),THANON KANCHANAWITHI (SURAT THANI),25391115
014,0752,สาขาธาตุพนม,THATPHANOM,25391122
014,0753,สาขาท่าเรือพระแท่น,THARUAPHRATHAEN BRANCH,25391129
014,0758,สาขาภูเรือ (เลย),PURUA (LOEI),25400117
014,0761,สาขานาหว้า (นครพนม),NAWA (NAKORNPANOM),25400228
014,0762,สาขาถนนราษฎร์ยินดี (หาดใหญ่),THANON RASYINDEE (HADYAI),25400314
014,0764,สาขาถนนทรงพล (นครปฐม),THANON SONGPOL (NAKORNPATOM),25400425
014,0765,สาขาวิหารแดง,WIHARNDAENG BRANCH,25400523
014,0766,สาขาหัวหิน,HAUHIN,25400530
014,0767,สาขาบรรพตพิสัย,BANPOTPISAI BRANCH,25400620
014,0769,สาขากำแพงแสน (มหาวิทยาลัยเกษตรศาสตร์),KAMPANGSAENG (KASETSART UNIVERSITY) BRANCH,25400815
014,0770,สาขาเสนา (อยุธยา),SENA (AYUTTHAYA) BRANCH,25400808
014,0773,สาขานางรอง,NARNGRONG,25401121
